{
  "id": "vanilla-advisor-close-tooltip",
  "tooltip": {
    "target": "close_button",
    "x": 980,
    "y": 100,
    "width": 160,
    "padding": 16
  },
  "description": "Installed vanilla advisor-role window with its unpopulated leader template hidden. Immediate CLOSE tooltip at explicitly declared viewport coordinates; no campaign, native placement or timing claim.",
  "resolution": {
    "width": 1280,
    "height": 720
  },
  "uiScale": 1,
  "state": "normal",
  "language": "l_english",
  "animationTimeSeconds": 0,
  "variables": {},
  "flags": {},
  "lists": {},
  "localisation": {},
  "values": {},
  "scriptedGui": {},
  "visibility": {
    "leader": false
  },
  "elementStates": {},
  "selectedFrames": {},
  "scrollOffsets": {},
  "guiCosts": {},
  "scriptCosts": {},
  "expectations": {
    "visible": [],
    "hidden": [],
    "containedBy": {},
    "centeredOn": {}
  }
}
